text,char,word,index,index_num,line
All losses are restor'd and sorrows end.,40,7,XXX,30,14
XXXI,4,1,XXXI,31,0
"Thy bosom is endeared with all hearts,",38,7,XXXI,31,1
Which I by lacking have supposed dead;,38,7,XXXI,31,2
"And there reigns Love, and all Love's loving parts,",51,9,XXXI,31,3
And all those friends which I thought buried.,45,8,XXXI,31,4
How many a holy and obsequious tear,35,7,XXXI,31,5
"Hath dear religious love stol'n from mine eye,",46,8,XXXI,31,6
"As interest of the dead, which now appear",41,8,XXXI,31,7
But things remov'd that hidden in thee lie!,43,8,XXXI,31,8
"Thou art the grave where buried love doth live,",47,9,XXXI,31,9
"Hung with the trophies of my lovers gone,",41,8,XXXI,31,10
"Who all their parts of me to thee did give,",43,10,XXXI,31,11
That due of many now is thine alone:,36,8,XXXI,31,12
"Their images I lov'd, I view in thee,",37,8,XXXI,31,13
And thou--all they--hast all the all of me.,43,8,XXXI,31,14
XXXII,5,1,XXXII,32,0
"If thou survive my well-contented day,",38,6,XXXII,32,1
When that churl Death my bones with dust shall cover,52,10,XXXII,32,2
And shalt by fortune once more re-survey,40,7,XXXII,32,3
"These poor rude lines of thy deceased lover,",44,8,XXXII,32,4
"Compare them with the bett'ring of the time,",44,8,XXXII,32,5
"And though they be outstripp'd by every pen,",44,8,XXXII,32,6
"Reserve them for my love, not for their rhyme,",46,9,XXXII,32,7
Exceeded by the height of happier men.,38,7,XXXII,32,8
O! then vouchsafe me but this loving thought:,45,8,XXXII,32,9
"'Had my friend's Muse grown with this growing age,",50,9,XXXII,32,10
"A dearer birth than this his love had brought,",46,9,XXXII,32,11
To march in ranks of better equipage:,37,7,XXXII,32,12
"But since he died and poets better prove,",41,8,XXXII,32,13
"Theirs for their style I'll read, his for his love'.",52,10,XXXII,32,14
XXXIII,6,1,XXXIII,33,0
Full many a glorious morning have I seen,40,8,XXXIII,33,1
"Flatter the mountain tops with sovereign eye,",45,7,XXXIII,33,2
"Kissing with golden face the meadows green,",43,7,XXXIII,33,3
Gilding pale streams with heavenly alchemy;,43,6,XXXIII,33,4
Anon permit the basest clouds to ride,37,7,XXXIII,33,5
"With ugly rack on his celestial face,",37,7,XXXIII,33,6
"And from the forlorn world his visage hide,",43,8,XXXIII,33,7
Stealing unseen to west with this disgrace:,43,7,XXXIII,33,8
"Even so my sun one early morn did shine,",40,9,XXXIII,33,9
With all triumphant splendour on my brow;,41,7,XXXIII,33,10
"But out! alack! he was but one hour mine,",41,9,XXXIII,33,11
The region cloud hath mask'd him from me now.,45,9,XXXIII,33,12
Yet him for this my love no whit disdaineth;,44,9,XXXIII,33,13
Suns of the world may stain when heaven's sun staineth.,55,10,XXXIII,33,14
XXXIV,5,1,XXXIV,34,0
"Why didst thou promise such a beauteous day,",44,8,XXXIV,34,1
"And make me travel forth without my cloak,",42,8,XXXIV,34,2
"To let base clouds o'ertake me in my way,",41,9,XXXIV,34,3
Hiding thy bravery in their rotten smoke?,41,7,XXXIV,34,4
"'Tis not enough that through the cloud thou break,",50,9,XXXIV,34,5
"To dry the rain on my storm-beaten face,",40,8,XXXIV,34,6
"For no man well of such a salve can speak,",42,10,XXXIV,34,7
"That heals the wound, and cures not the disgrace:",49,9,XXXIV,34,8
Nor can thy shame give physic to my grief;,42,9,XXXIV,34,9
"Though thou repent, yet I have still the loss:",46,9,XXXIV,34,10
The offender's sorrow lends but weak relief,43,7,XXXIV,34,11
To him that bears the strong offence's cross.,45,8,XXXIV,34,12
"Ah! but those tears are pearl which thy love sheds,",51,10,XXXIV,34,13
And they are rich and ransom all ill deeds.,43,9,XXXIV,34,14
XXXV,4,1,XXXV,35,0
No more be griev'd at that which thou hast done:,48,10,XXXV,35,1
"Roses have thorns, and silver fountains mud:",44,7,XXXV,35,2
"Clouds and eclipses stain both moon and sun,",44,8,XXXV,35,3
And loathsome canker lives in sweetest bud.,43,7,XXXV,35,4
"All men make faults, and even I in this,",40,9,XXXV,35,5
"Authorizing thy trespass with compare,",38,5,XXXV,35,6
"Myself corrupting, salving thy amiss,",37,5,XXXV,35,7
Excusing thy sins more than thy sins are;,41,8,XXXV,35,8
"For to thy sensual fault I bring in sense,--",44,9,XXXV,35,9
"Thy adverse party is thy advocate,--",36,6,XXXV,35,10
And 'gainst myself a lawful plea commence:,42,7,XXXV,35,11
"Such civil war is in my love and hate,",38,9,XXXV,35,12
"That I an accessary needs must be,",34,7,XXXV,35,13
To that sweet thief which sourly robs from me.,46,9,XXXV,35,14
XXXVI,5,1,XXXVI,36,0
"Let me confess that we two must be twain,",41,9,XXXVI,36,1
Although our undivided loves are one:,37,6,XXXVI,36,2
"So shall those blots that do with me remain,",44,9,XXXVI,36,3
"Without thy help, by me be borne alone.",39,8,XXXVI,36,4
"In our two loves there is but one respect,",42,9,XXXVI,36,5
"Though in our lives a separable spite,",38,7,XXXVI,36,6
"Which though it alter not love's sole effect,",45,8,XXXVI,36,7
Yet doth it steal sweet hours from love's delight.,50,9,XXXVI,36,8
"I may not evermore acknowledge thee,",36,6,XXXVI,36,9
"Lest my bewailed guilt should do thee shame,",44,8,XXXVI,36,10
"Nor thou with public kindness honour me,",40,7,XXXVI,36,11
Unless thou take that honour from thy name:,43,8,XXXVI,36,12
"But do not so, I love thee in such sort,",40,10,XXXVI,36,13
"As thou being mine, mine is thy good report.",44,9,XXXVI,36,14
XXXVII,6,1,XXXVII,37,0
As a decrepit father takes delight,34,6,XXXVII,37,1
"To see his active child do deeds of youth,",42,9,XXXVII,37,2
"So I, made lame by Fortune's dearest spite,",43,8,XXXVII,37,3
Take all my comfort of thy worth and truth;,43,9,XXXVII,37,4
"For whether beauty, birth, or wealth, or wit,",45,8,XXXVII,37,5
"Or any of these all, or all, or more,",37,9,XXXVII,37,6
"Entitled in thy parts, do crowned sit,",38,7,XXXVII,37,7
"I make my love engrafted, to this store:",40,8,XXXVII,37,8
"So then I am not lame, poor, nor despis'd,",42,9,XXXVII,37,9
Whilst that this shadow doth such substance give,48,8,XXXVII,37,10
"That I in thy abundance am suffic'd,",36,7,XXXVII,37,11
And by a part of all thy glory live.,36,9,XXXVII,37,12
"Look what is best, that best I wish in thee:",44,10,XXXVII,37,13
This wish I have; then ten times happy me!,42,9,XXXVII,37,14
XXXVIII,7,1,XXXVIII,38,0
"How can my muse want subject to invent,",39,8,XXXVIII,38,1
"While thou dost breathe, that pour'st into my verse",51,9,XXXVIII,38,2
"Thine own sweet argument, too excellent",39,6,XXXVIII,38,3
For every vulgar paper to rehearse?,35,6,XXXVIII,38,4
"O! give thy self the thanks, if aught in me",43,10,XXXVIII,38,5
Worthy perusal stand against thy sight;,39,6,XXXVIII,38,6
"For who's so dumb that cannot write to thee,",44,9,XXXVIII,38,7
When thou thy self dost give invention light?,45,8,XXXVIII,38,8
"Be thou the tenth Muse, ten times more in worth",47,10,XXXVIII,38,9
Than those old nine which rhymers invocate;,43,7,XXXVIII,38,10
"And he that calls on thee, let him bring forth",46,10,XXXVIII,38,11
Eternal numbers to outlive long date.,37,6,XXXVIII,38,12
"If my slight muse do please these curious days,",47,9,XXXVIII,38,13
"The pain be mine, but thine shall be the praise.",48,10,XXXVIII,38,14
XXXIX,5,1,XXXIX,39,0
"O! how thy worth with manners may I sing,",41,9,XXXIX,39,1
When thou art all the better part of me?,40,9,XXXIX,39,2
What can mine own praise to mine own self bring?,48,10,XXXIX,39,3
And what is't but mine own when I praise thee?,46,10,XXXIX,39,4
"Even for this, let us divided live,",35,7,XXXIX,39,5
"And our dear love lose name of single one,",42,9,XXXIX,39,6
That by this separation I may give,34,7,XXXIX,39,7
That due to thee which thou deserv'st alone.,44,8,XXXIX,39,8
"O absence! what a torment wouldst thou prove,",45,8,XXXIX,39,9
"Were it not thy sour leisure gave sweet leave,",46,9,XXXIX,39,10
"To entertain the time with thoughts of love,",44,8,XXXIX,39,11
"Which time and thoughts so sweetly doth deceive,",48,8,XXXIX,39,12
"And that thou teachest how to make one twain,",45,9,XXXIX,39,13
By praising him here who doth hence remain.,43,8,XXXIX,39,14
XL,2,1,XL,40,0
"Take all my loves, my love, yea take them all;",46,10,XL,40,1
What hast thou then more than thou hadst before?,48,9,XL,40,2
"No love, my love, that thou mayst true love call;",49,10,XL,40,3
"All mine was thine, before thou hadst this more.",48,9,XL,40,4
"Then, if for my love, thou my love receivest,",45,9,XL,40,5
"I cannot blame thee, for my love thou usest;",44,9,XL,40,6
"But yet be blam'd, if thou thy self deceivest",45,9,XL,40,7
By wilful taste of what thyself refusest.,41,7,XL,40,8
"I do forgive thy robbery, gentle thief,",39,7,XL,40,9
Although thou steal thee all my poverty:,40,7,XL,40,10
"And yet, love knows it is a greater grief",41,9,XL,40,11
"To bear love's wrong, than hate's known injury.",47,8,XL,40,12
"Lascivious grace, in whom all ill well shows,",45,8,XL,40,13
Kill me with spites yet we must not be foes.,44,10,XL,40,14
XLI,3,1,XLI,41,0
"Those pretty wrongs that liberty commits,",41,6,XLI,41,1
"When I am sometime absent from thy heart,",41,8,XLI,41,2
"Thy beauty, and thy years full well befits,",43,8,XLI,41,3
For still temptation follows where thou art.,44,7,XLI,41,4
"Gentle thou art, and therefore to be won,",41,8,XLI,41,5
"Beauteous thou art, therefore to be assail'd;",45,7,XLI,41,6
"And when a woman woos, what woman's son",39,8,XLI,41,7
Will sourly leave her till he have prevail'd?,45,8,XLI,41,8
"Ay me! but yet thou mightst my seat forbear,",44,9,XLI,41,9
"And chide thy beauty and thy straying youth,",44,8,XLI,41,10
Who lead thee in their riot even there,38,8,XLI,41,11
Where thou art forced to break a twofold truth:--,49,9,XLI,41,12
"Hers by thy beauty tempting her to thee,",40,8,XLI,41,13
Thine by thy beauty being false to me.,38,8,XLI,41,14
XLII,4,1,XLII,42,0
"That thou hast her it is not all my grief,",42,10,XLII,42,1
And yet it may be said I loved her dearly;,42,10,XLII,42,2
"That she hath thee is of my wailing chief,",42,9,XLII,42,3
A loss in love that touches me more nearly.,43,9,XLII,42,4
Loving offenders thus I will excuse ye:,39,7,XLII,42,5
"Thou dost love her, because thou know'st I love her;",52,10,XLII,42,6
"And for my sake even so doth she abuse me,",42,10,XLII,42,7
Suffering my friend for my sake to approve her.,47,9,XLII,42,8
"If I lose thee, my loss is my love's gain,",42,10,XLII,42,9
"And losing her, my friend hath found that loss;",47,9,XLII,42,10
"Both find each other, and I lose both twain,",44,9,XLII,42,11
And both for my sake lay on me this cross:,42,10,XLII,42,12
But here's the joy; my friend and I are one;,44,10,XLII,42,13
Sweet flattery! then she loves but me alone.,44,8,XLII,42,14
XLIII,5,1,XLIII,43,0
"When most I wink, then do mine eyes best see,",45,10,XLIII,43,1
For all the day they view things unrespected;,45,8,XLIII,43,2
"But when I sleep, in dreams they look on thee,",46,10,XLIII,43,3
"And darkly bright, are bright in dark directed.",47,8,XLIII,43,4
"Then thou, whose shadow shadows doth make bright,",49,8,XLIII,43,5
How would thy shadow's form form happy show,43,8,XLIII,43,6
"To the clear day with thy much clearer light,",45,9,XLIII,43,7
When to unseeing eyes thy shade shines so!,42,8,XLIII,43,8
"How would, I say, mine eyes be blessed made",43,9,XLIII,43,9
"By looking on thee in the living day,",37,8,XLIII,43,10
When in dead night thy fair imperfect shade,43,8,XLIII,43,11
Through heavy sleep on sightless eyes doth stay!,48,8,XLIII,43,12
"All days are nights to see till I see thee,",43,10,XLIII,43,13
And nights bright days when dreams do show thee me.,51,10,XLIII,43,14
XLIV,4,1,XLIV,44,0
"If the dull substance of my flesh were thought,",47,9,XLIV,44,1
Injurious distance should not stop my way;,42,7,XLIV,44,2
"For then despite of space I would be brought,",45,9,XLIV,44,3
"From limits far remote, where thou dost stay.",45,8,XLIV,44,4
No matter then although my foot did stand,41,8,XLIV,44,5
Upon the farthest earth remov'd from thee;,42,7,XLIV,44,6
"For nimble thought can jump both sea and land,",46,9,XLIV,44,7
As soon as think the place where he would be.,45,10,XLIV,44,8
"But, ah! thought kills me that I am not thought,",48,10,XLIV,44,9
"To leap large lengths of miles when thou art gone,",50,10,XLIV,44,10
"But that so much of earth and water wrought,",44,9,XLIV,44,11
I must attend time's leisure with my moan;,42,8,XLIV,44,12
Receiving nought by elements so slow,36,6,XLIV,44,13
"But heavy tears, badges of either's woe.",40,7,XLIV,44,14
XLV,3,1,XLV,45,0
"The other two, slight air, and purging fire",43,8,XLV,45,1
"Are both with thee, wherever I abide;",37,7,XLV,45,2
"The first my thought, the other my desire,",42,8,XLV,45,3
These present-absent with swift motion slide.,45,6,XLV,45,4
For when these quicker elements are gone,40,7,XLV,45,5
"In tender embassy of love to thee,",34,7,XLV,45,6
"My life, being made of four, with two alone",43,9,XLV,45,7
"Sinks down to death, oppress'd with melancholy;",47,7,XLV,45,8
Until life's composition be recur'd,35,5,XLV,45,9
"By those swift messengers return'd from thee,",45,7,XLV,45,10
"Who even but now come back again, assur'd,",42,8,XLV,45,11
"Of thy fair health, recounting it to me:",40,8,XLV,45,12
"This told, I joy; but then no longer glad,",42,9,XLV,45,13
"I send them back again, and straight grow sad.",46,9,XLV,45,14
XLVI,4,1,XLVI,46,0
"Mine eye and heart are at a mortal war,",39,9,XLVI,46,1
How to divide the conquest of thy sight;,40,8,XLVI,46,2
"Mine eye my heart thy picture's sight would bar,",48,9,XLVI,46,3
My heart mine eye the freedom of that right.,44,9,XLVI,46,4
"My heart doth plead that thou in him dost lie,--",48,10,XLVI,46,5
A closet never pierc'd with crystal eyes--,42,7,XLVI,46,6
"But the defendant doth that plea deny,",38,7,XLVI,46,7
And says in him thy fair appearance lies.,41,8,XLVI,46,8
To side this title is impannelled,33,6,XLVI,46,9
"A quest of thoughts, all tenants to the heart;",46,9,XLVI,46,10
And by their verdict is determined,34,6,XLVI,46,11
"The clear eye's moiety, and the dear heart's part:",50,9,XLVI,46,12
"As thus; mine eye's due is thy outward part,",44,9,XLVI,46,13
"And my heart's right, thy inward love of heart.",47,9,XLVI,46,14
XLVII,5,1,XLVII,47,0
"Betwixt mine eye and heart a league is took,",44,9,XLVII,47,1
And each doth good turns now unto the other:,44,9,XLVII,47,2
"When that mine eye is famish'd for a look,",42,9,XLVII,47,3
"Or heart in love with sighs himself doth smother,",49,9,XLVII,47,4
"With my love's picture then my eye doth feast,",46,9,XLVII,47,5
And to the painted banquet bids my heart;,41,8,XLVII,47,6
"Another time mine eye is my heart's guest,",42,8,XLVII,47,7
And in his thoughts of love doth share a part:,46,10,XLVII,47,8
"So, either by thy picture or my love,",37,8,XLVII,47,9
"Thy self away, art present still with me;",41,8,XLVII,47,10
"For thou not farther than my thoughts canst move,",49,9,XLVII,47,11
"And I am still with them, and they with thee;",45,10,XLVII,47,12
"Or, if they sleep, thy picture in my sight",42,9,XLVII,47,13
"Awakes my heart, to heart's and eye's delight.",46,8,XLVII,47,14
XLVIII,6,1,XLVIII,48,0
"How careful was I when I took my way,",37,9,XLVIII,48,1
"Each trifle under truest bars to thrust,",40,7,XLVIII,48,2
That to my use it might unused stay,35,8,XLVIII,48,3
"From hands of falsehood, in sure wards of trust!",48,9,XLVIII,48,4
"But thou, to whom my jewels trifles are,",40,8,XLVIII,48,5
"Most worthy comfort, now my greatest grief,",43,7,XLVIII,48,6
"Thou best of dearest, and mine only care,",41,8,XLVIII,48,7
Art left the prey of every vulgar thief.,40,8,XLVIII,48,8
"Thee have I not lock'd up in any chest,",39,9,XLVIII,48,9
"Save where thou art not, though I feel thou art,",48,10,XLVIII,48,10
"Within the gentle closure of my breast,",39,7,XLVIII,48,11
From whence at pleasure thou mayst come and part;,49,9,XLVIII,48,12
"And even thence thou wilt be stol'n I fear,",43,9,XLVIII,48,13
For truth proves thievish for a prize so dear.,46,9,XLVIII,48,14
XLIX,4,1,XLIX,49,0
"Against that time, if ever that time come,",42,8,XLIX,49,1
"When I shall see thee frown on my defects,",42,9,XLIX,49,2
"When as thy love hath cast his utmost sum,",42,9,XLIX,49,3
Call'd to that audit by advis'd respects;,41,7,XLIX,49,4
"Against that time when thou shalt strangely pass,",49,8,XLIX,49,5
"And scarcely greet me with that sun, thine eye,",47,9,XLIX,49,6
"When love, converted from the thing it was,",43,8,XLIX,49,7
Shall reasons find of settled gravity;,38,6,XLIX,49,8
"Against that time do I ensconce me here,",40,8,XLIX,49,9
"Within the knowledge of mine own desert,",40,7,XLIX,49,10
"And this my hand, against my self uprear,",41,8,XLIX,49,11
To guard the lawful reasons on thy part:,40,8,XLIX,49,12
"To leave poor me thou hast the strength of laws,",48,10,XLIX,49,13
Since why to love I can allege no cause.,40,9,XLIX,49,14
L,1,1,L,50,0
"How heavy do I journey on the way,",34,8,L,50,1
"When what I seek, my weary travel's end,",40,8,L,50,2
"Doth teach that ease and that repose to say,",44,9,L,50,3
'Thus far the miles are measured from thy friend!',50,9,L,50,4
"The beast that bears me, tired with my woe,",43,9,L,50,5
"Plods dully on, to bear that weight in me,",42,9,L,50,6
As if by some instinct the wretch did know,42,9,L,50,7
"His rider lov'd not speed, being made from thee:",48,9,L,50,8
"The bloody spur cannot provoke him on,",38,7,L,50,9
"That sometimes anger thrusts into his hide,",43,7,L,50,10
"Which heavily he answers with a groan,",38,7,L,50,11
More sharp to me than spurring to his side;,43,9,L,50,12
"For that same groan doth put this in my mind,",45,10,L,50,13
"My grief lies onward, and my joy behind.",40,8,L,50,14
LI,2,1,LI,51,0
Thus can my love excuse the slow offence,40,8,LI,51,1
Of my dull bearer when from thee I speed:,41,9,LI,51,2
From where thou art why should I haste me thence?,49,10,LI,51,3
"Till I return, of posting is no need.",37,8,LI,51,4
"O! what excuse will my poor beast then find,",44,9,LI,51,5
When swift extremity can seem but slow?,39,7,LI,51,6
"Then should I spur, though mounted on the wind,",47,9,LI,51,7
"In winged speed no motion shall I know,",39,8,LI,51,8
Then can no horse with my desire keep pace;,43,9,LI,51,9
"Therefore desire, of perfect'st love being made,",48,7,LI,51,10
Shall neigh--no dull flesh--in his fiery race;,46,7,LI,51,11
"But love, for love, thus shall excuse my jade,--",48,9,LI,51,12
"'Since from thee going, he went wilful-slow,",44,7,LI,51,13
"Towards thee I'll run, and give him leave to go.'",49,10,LI,51,14
LII,3,1,LII,52,0
"So am I as the rich, whose blessed key,",39,9,LII,52,1
"Can bring him to his sweet up-locked treasure,",46,8,LII,52,2
"The which he will not every hour survey,",40,8,LII,52,3
For blunting the fine point of seldom pleasure.,47,8,LII,52,4
"Therefore are feasts so solemn and so rare,",43,8,LII,52,5
"Since, seldom coming in that long year set,",43,8,LII,52,6
"Like stones of worth they thinly placed are,",44,8,LII,52,7
Or captain jewels in the carcanet.,34,6,LII,52,8
"So is the time that keeps you as my chest,",42,10,LII,52,9
"Or as the wardrobe which the robe doth hide,",44,9,LII,52,10
"To make some special instant special-blest,",43,6,LII,52,11
By new unfolding his imprison'd pride.,38,6,LII,52,12
"Blessed are you whose worthiness gives scope,",45,7,LII,52,13
"Being had, to triumph; being lacked, to hope.",45,8,LII,52,14
LIII,4,1,LIII,53,0
"What is your substance, whereof are you made,",45,8,LIII,53,1
That millions of strange shadows on you tend?,45,8,LIII,53,2
"Since every one, hath every one, one shade,",43,8,LIII,53,3
"And you but one, can every shadow lend.",39,8,LIII,53,4
"Describe Adonis, and the counterfeit",36,5,LIII,53,5
Is poorly imitated after you;,29,5,LIII,53,6
"On Helen's cheek all art of beauty set,",39,8,LIII,53,7
And you in Grecian tires are painted new:,41,8,LIII,53,8
"Speak of the spring, and foison of the year,",44,9,LIII,53,9
"The one doth shadow of your beauty show,",40,8,LIII,53,10
The other as your bounty doth appear;,37,7,LIII,53,11
And you in every blessed shape we know.,39,8,LIII,53,12
"In all external grace you have some part,",41,8,LIII,53,13
"But you like none, none you, for constant heart.",48,9,LIII,53,14
LIV,3,1,LIV,54,0
O! how much more doth beauty beauteous seem,43,8,LIV,54,1
By that sweet ornament which truth doth give.,45,8,LIV,54,2
"The rose looks fair, but fairer we it deem",42,9,LIV,54,3
"For that sweet odour, which doth in it live.",44,9,LIV,54,4
The canker blooms have full as deep a dye,41,9,LIV,54,5
As the perfumed tincture of the roses.,38,7,LIV,54,6
"Hang on such thorns, and play as wantonly",41,8,LIV,54,7
When summer's breath their masked buds discloses:,49,7,LIV,54,8
"But, for their virtue only is their show,",41,8,LIV,54,9
"They live unwoo'd, and unrespected fade;",40,6,LIV,54,10
Die to themselves. Sweet roses do not so;,41,8,LIV,54,11
"Of their sweet deaths, are sweetest odours made:",48,8,LIV,54,12
"And so of you, beauteous and lovely youth,",42,8,LIV,54,13
"When that shall vade, by verse distills your truth.",51,9,LIV,54,14
LV,2,1,LV,55,0
"Not marble, nor the gilded monuments",36,6,LV,55,1
"Of princes, shall outlive this powerful rhyme;",46,7,LV,55,2
But you shall shine more bright in these contents,49,9,LV,55,3
"Than unswept stone, besmear'd with sluttish time.",49,7,LV,55,4
"When wasteful war shall statues overturn,",41,6,LV,55,5
"And broils root out the work of masonry,",40,8,LV,55,6
"Nor Mars his sword, nor war's quick fire shall burn",51,10,LV,55,7
The living record of your memory.,33,6,LV,55,8
"'Gainst death, and all-oblivious enmity",39,5,LV,55,9
Shall you pace forth; your praise shall still find room,55,10,LV,55,10
Even in the eyes of all posterity,33,7,LV,55,11
That wear this world out to the ending doom.,44,9,LV,55,12
"So, till the judgment that yourself arise,",42,7,LV,55,13
"You live in this, and dwell in lovers' eyes.",44,9,LV,55,14
LVI,3,1,LVI,56,0
"Sweet love, renew thy force; be it not said",43,9,LVI,56,1
"Thy edge should blunter be than appetite,",41,7,LVI,56,2
"Which but to-day by feeding is allay'd,",39,7,LVI,56,3
To-morrow sharpened in his former might:,40,6,LVI,56,4
"So, love, be thou, although to-day thou fill",44,8,LVI,56,5
"Thy hungry eyes, even till they wink with fulness,",50,9,LVI,56,6
"To-morrow see again, and do not kill",36,7,LVI,56,7
"The spirit of love, with a perpetual dulness.",45,8,LVI,56,8
Let this sad interim like the ocean be,38,8,LVI,56,9
"Which parts the shore, where two contracted new",47,8,LVI,56,10
"Come daily to the banks, that when they see",43,9,LVI,56,11
"Return of love, more blest may be the view;",43,9,LVI,56,12
"Or call it winter, which being full of care,",44,9,LVI,56,13
"Makes summer's welcome, thrice more wished, more rare.",54,8,LVI,56,14
LVII,4,1,LVII,57,0
"Being your slave what should I do but tend,",43,9,LVII,57,1
"Upon the hours, and times of your desire?",41,8,LVII,57,2
I have no precious time at all to spend;,40,9,LVII,57,3
"Nor services to do, till you require.",37,7,LVII,57,4
"Nor dare I chide the world-without-end hour,",44,7,LVII,57,5
"Whilst I, my sovereign, watch the clock for you,",48,9,LVII,57,6
"Nor think the bitterness of absence sour,",41,7,LVII,57,7
When you have bid your servant once adieu;,42,8,LVII,57,8
Nor dare I question with my jealous thought,43,8,LVII,57,9
"Where you may be, or your affairs suppose,",42,8,LVII,57,10
"But, like a sad slave, stay and think of nought",47,10,LVII,57,11
"Save, where you are, how happy you make those.",46,9,LVII,57,12
"So true a fool is love, that in your will,",42,10,LVII,57,13
"Though you do anything, he thinks no ill.",41,8,LVII,57,14
LVIII,5,1,LVIII,58,0
"That god forbid, that made me first your slave,",47,9,LVIII,58,1
"I should in thought control your times of pleasure,",51,9,LVIII,58,2
"Or at your hand the account of hours to crave,",46,10,LVIII,58,3
"Being your vassal, bound to stay your leisure!",46,8,LVIII,58,4
"O! let me suffer, being at your beck,",37,8,LVIII,58,5
The imprison'd absence of your liberty;,39,6,LVIII,58,6
"And patience, tame to sufferance, bide each check,",50,8,LVIII,58,7
Without accusing you of injury.,31,5,LVIII,58,8
"Be where you list, your charter is so strong",44,9,LVIII,58,9
That you yourself may privilage your time,41,7,LVIII,58,10
To what you will; to you it doth belong,39,9,LVIII,58,11
Yourself to pardon of self-doing crime.,39,6,LVIII,58,12
"I am to wait, though waiting so be hell,",40,9,LVIII,58,13
Not blame your pleasure be it ill or well.,42,9,LVIII,58,14
LIX,3,1,LIX,59,0
"If there be nothing new, but that which is",42,9,LIX,59,1
"Hath been before, how are our brains beguil'd,",46,8,LIX,59,2
Which labouring for invention bear amiss,40,6,LIX,59,3
The second burthen of a former child!,37,7,LIX,59,4
"O! that record could with a backward look,",42,8,LIX,59,5
"Even of five hundred courses of the sun,",40,8,LIX,59,6
"Show me your image in some antique book,",40,8,LIX,59,7
Since mind at first in character was done!,42,8,LIX,59,8
That I might see what the old world could say,45,10,LIX,59,9
To this composed wonder of your frame;,38,7,LIX,59,10
"Wh'r we are mended, or wh'r better they,",40,8,LIX,59,11
Or whether revolution be the same.,34,6,LIX,59,12
"O! sure I am the wits of former days,",37,9,LIX,59,13
To subjects worse have given admiring praise.,45,7,LIX,59,14
LX,2,1,LX,60,0
"Like as the waves make towards the pebbled shore,",49,9,LX,60,1
So do our minutes hasten to their end;,38,8,LX,60,2
"Each changing place with that which goes before,",48,8,LX,60,3
In sequent toil all forwards do contend.,40,7,LX,60,4
"Nativity, once in the main of light,",36,7,LX,60,5
