text,char,word,index,index_num,line
"But thence I learn and find the lesson true,",44,9,CXVIII,118,13
Drugs poison him that so fell sick of you.,42,9,CXVIII,118,14
CXIX,4,1,CXIX,119,0
"What potions have I drunk of Siren tears,",41,8,CXIX,119,1
"Distill'd from limbecks foul as hell within,",44,7,CXIX,119,2
"Applying fears to hopes, and hopes to fears,",44,8,CXIX,119,3
Still losing when I saw myself to win!,38,8,CXIX,119,4
"What wretched errors hath my heart committed,",45,7,CXIX,119,5
Whilst it hath thought itself so blessed never!,47,8,CXIX,119,6
"How have mine eyes out of their spheres been fitted,",52,10,CXIX,119,7
In the distraction of this madding fever!,41,7,CXIX,119,8
O benefit of ill! now I find true,33,8,CXIX,119,9
"That better is, by evil still made better;",42,8,CXIX,119,10
"And ruin'd love, when it is built anew,",39,8,CXIX,119,11
"Grows fairer than at first, more strong, far greater.",53,9,CXIX,119,12
"So I return rebuk'd to my content,",34,7,CXIX,119,13
And gain by ill thrice more than I have spent.,46,10,CXIX,119,14
CXX,3,1,CXX,120,0
"That you were once unkind befriends me now,",43,8,CXX,120,1
"And for that sorrow, which I then did feel,",43,9,CXX,120,2
"Needs must I under my transgression bow,",40,7,CXX,120,3
Unless my nerves were brass or hammer'd steel.,46,8,CXX,120,4
"For if you were by my unkindness shaken,",40,8,CXX,120,5
"As I by yours, you've pass'd a hell of time;",44,10,CXX,120,6
"And I, a tyrant, have no leisure taken",38,8,CXX,120,7
To weigh how once I suffer'd in your crime.,43,9,CXX,120,8
O! that our night of woe might have remember'd,46,9,CXX,120,9
"My deepest sense, how hard true sorrow hits,",44,8,CXX,120,10
"And soon to you, as you to me, then tender'd",44,10,CXX,120,11
"The humble salve, which wounded bosoms fits!",44,7,CXX,120,12
But that your trespass now becomes a fee;,41,8,CXX,120,13
"Mine ransoms yours, and yours must ransom me.",45,8,CXX,120,14
CXXI,4,1,CXXI,121,0
"'Tis better to be vile than vile esteem'd,",42,8,CXXI,121,1
When not to be receives reproach of being;,42,8,CXXI,121,2
"And the just pleasure lost, which is so deem'd",46,9,CXXI,121,3
"Not by our feeling, but by others' seeing:",42,8,CXXI,121,4
For why should others' false adulterate eyes,44,7,CXXI,121,5
Give salutation to my sportive blood?,37,6,CXXI,121,6
"Or on my frailties why are frailer spies,",41,8,CXXI,121,7
Which in their wills count bad what I think good?,49,10,CXXI,121,8
"No, I am that I am, and they that level",39,10,CXXI,121,9
At my abuses reckon up their own:,33,7,CXXI,121,10
I may be straight though they themselves be bevel;,50,9,CXXI,121,11
"By their rank thoughts, my deeds must not be shown;",51,10,CXXI,121,12
"Unless this general evil they maintain,",39,6,CXXI,121,13
All men are bad and in their badness reign.,43,9,CXXI,121,14
CXXII,5,1,CXXII,122,0
"Thy gift, thy tables, are within my brain",41,8,CXXII,122,1
"Full character'd with lasting memory,",37,5,CXXII,122,2
"Which shall above that idle rank remain,",40,7,CXXII,122,3
Beyond all date; even to eternity:,34,6,CXXII,122,4
"Or, at the least, so long as brain and heart",44,10,CXXII,122,5
Have faculty by nature to subsist;,34,6,CXXII,122,6
Till each to raz'd oblivion yield his part,42,8,CXXII,122,7
"Of thee, thy record never can be miss'd.",40,8,CXXII,122,8
"That poor retention could not so much hold,",43,8,CXXII,122,9
Nor need I tallies thy dear love to score;,42,9,CXXII,122,10
"Therefore to give them from me was I bold,",42,9,CXXII,122,11
To trust those tables that receive thee more:,45,8,CXXII,122,12
To keep an adjunct to remember thee,35,7,CXXII,122,13
Were to import forgetfulness in me.,35,6,CXXII,122,14
CXXIII,6,1,CXXIII,123,0
"No, Time, thou shalt not boast that I do change:",48,10,CXXIII,123,1
Thy pyramids built up with newer might,38,7,CXXIII,123,2
"To me are nothing novel, nothing strange;",41,7,CXXIII,123,3
They are but dressings of a former sight.,41,8,CXXIII,123,4
"Our dates are brief, and therefore we admire",44,8,CXXIII,123,5
What thou dost foist upon us that is old;,41,9,CXXIII,123,6
And rather make them born to our desire,39,8,CXXIII,123,7
Than think that we before have heard them told.,47,9,CXXIII,123,8
"Thy registers and thee I both defy,",35,7,CXXIII,123,9
"Not wondering at the present nor the past,",42,8,CXXIII,123,10
"For thy records and what we see doth lie,",41,9,CXXIII,123,11
Made more or less by thy continual haste.,41,8,CXXIII,123,12
This I do vow and this shall ever be;,37,9,CXXIII,123,13
I will be true despite thy scythe and thee.,43,9,CXXIII,123,14
CXXIV,5,1,CXXIV,124,0
"If my dear love were but the child of state,",44,10,CXXIV,124,1
"It might for Fortune's bastard be unfather'd,",45,7,CXXIV,124,2
"As subject to Time's love or to Time's hate,",44,9,CXXIV,124,3
"Weeds among weeds, or flowers with flowers gather'd.",52,8,CXXIV,124,4
"No, it was builded far from accident;",37,7,CXXIV,124,5
"It suffers not in smiling pomp, nor falls",41,8,CXXIV,124,6
"Under the blow of thralled discontent,",38,6,CXXIV,124,7
Whereto th' inviting time our fashion calls:,44,7,CXXIV,124,8
"It fears not policy, that heretic,",34,6,CXXIV,124,9
"Which works on leases of short-number'd hours,",46,7,CXXIV,124,10
"But all alone stands hugely politic,",36,6,CXXIV,124,11
"That it nor grows with heat, nor drowns with showers.",53,10,CXXIV,124,12
"To this I witness call the fools of time,",41,9,CXXIV,124,13
"Which die for goodness, who have lived for crime.",49,9,CXXIV,124,14
CXXV,4,1,CXXV,125,0
"Were't aught to me I bore the canopy,",37,8,CXXV,125,1
"With my extern the outward honouring,",37,6,CXXV,125,2
"Or laid great bases for eternity,",33,6,CXXV,125,3
Which proves more short than waste or ruining?,46,8,CXXV,125,4
Have I not seen dwellers on form and favour,43,9,CXXV,125,5
Lose all and more by paying too much rent,41,9,CXXV,125,6
"For compound sweet; forgoing simple savour,",43,6,CXXV,125,7
"Pitiful thrivers, in their gazing spent?",40,6,CXXV,125,8
"No; let me be obsequious in thy heart,",38,8,CXXV,125,9
"And take thou my oblation, poor but free,",41,8,CXXV,125,10
"Which is not mix'd with seconds, knows no art,",46,9,CXXV,125,11
"But mutual render, only me for thee.",36,7,CXXV,125,12
"Hence, thou suborned informer! a true soul",42,7,CXXV,125,13
"When most impeach'd, stands least in thy control.",49,8,CXXV,125,14
CXXVI,5,1,CXXVI,126,0
"O thou, my lovely boy, who in thy power",39,9,CXXVI,126,1
"Dost hold Time's fickle glass, his fickle hour;",47,8,CXXVI,126,2
"Who hast by waning grown, and therein show'st",45,8,CXXVI,126,3
"Thy lovers withering, as thy sweet self grow'st.",48,8,CXXVI,126,4
"If Nature, sovereign mistress over wrack,",41,6,CXXVI,126,5
"As thou goest onwards, still will pluck thee back,",50,9,CXXVI,126,6
"She keeps thee to this purpose, that her skill",46,9,CXXVI,126,7
May time disgrace and wretched minutes kill.,44,7,CXXVI,126,8
"Yet fear her, O thou minion of her pleasure!",44,9,CXXVI,126,9
"She may detain, but not still keep, her treasure:",49,9,CXXVI,126,10
"Her audit (though delayed) answered must be,",44,7,CXXVI,126,11
And her quietus is to render thee.,34,7,CXXVI,126,12
CXXVII,6,1,CXXVII,127,0
"In the old age black was not counted fair,",42,9,CXXVII,127,1
"Or if it were, it bore not beauty's name;",41,9,CXXVII,127,2
"But now is black beauty's successive heir,",42,7,CXXVII,127,3
And beauty slander'd with a bastard shame:,42,7,CXXVII,127,4
"For since each hand hath put on Nature's power,",47,9,CXXVII,127,5
"Fairing the foul with Art's false borrowed face,",48,8,CXXVII,127,6
"Sweet beauty hath no name, no holy bower,",41,8,CXXVII,127,7
"But is profan'd, if not lives in disgrace.",42,8,CXXVII,127,8
"Therefore my mistress' eyes are raven black,",44,7,CXXVII,127,9
"Her eyes so suited, and they mourners seem",42,8,CXXVII,127,10
"At such who, not born fair, no beauty lack,",43,9,CXXVII,127,11
Sland'ring creation with a false esteem:,40,6,CXXVII,127,12
"Yet so they mourn becoming of their woe,",40,8,CXXVII,127,13
That every tongue says beauty should look so.,45,8,CXXVII,127,14
CXXVIII,7,1,CXXVIII,128,0
"How oft when thou, my music, music play'st,",43,8,CXXVIII,128,1
Upon that blessed wood whose motion sounds,42,7,CXXVIII,128,2
With thy sweet fingers when thou gently sway'st,47,8,CXXVIII,128,3
"The wiry concord that mine ear confounds,",41,7,CXXVIII,128,4
"Do I envy those jacks that nimble leap,",39,8,CXXVIII,128,5
"To kiss the tender inward of thy hand,",38,8,CXXVIII,128,6
"Whilst my poor lips which should that harvest reap,",51,9,CXXVIII,128,7
At the wood's boldness by thee blushing stand!,46,8,CXXVIII,128,8
"To be so tickled, they would change their state",47,9,CXXVIII,128,9
"And situation with those dancing chips,",39,6,CXXVIII,128,10
"O'er whom thy fingers walk with gentle gait,",44,8,CXXVIII,128,11
Making dead wood more bless'd than living lips.,47,8,CXXVIII,128,12
"Since saucy jacks so happy are in this,",39,8,CXXVIII,128,13
"Give them thy fingers, me thy lips to kiss.",43,9,CXXVIII,128,14
CXXIX,5,1,CXXIX,129,0
The expense of spirit in a waste of shame,41,9,CXXIX,129,1
"Is lust in action: and till action, lust",40,8,CXXIX,129,2
"Is perjur'd, murderous, bloody, full of blame,",46,7,CXXIX,129,3
"Savage, extreme, rude, cruel, not to trust;",43,7,CXXIX,129,4
Enjoy'd no sooner but despised straight;,40,6,CXXIX,129,5
"Past reason hunted; and no sooner had,",38,7,CXXIX,129,6
"Past reason hated, as a swallow'd bait,",39,7,CXXIX,129,7
On purpose laid to make the taker mad:,38,8,CXXIX,129,8
Mad in pursuit and in possession so;,36,7,CXXIX,129,9
"Had, having, and in quest, to have extreme;",43,8,CXXIX,129,10
"A bliss in proof,-- and prov'd, a very woe;",43,9,CXXIX,129,11
"Before, a joy propos'd; behind a dream.",39,7,CXXIX,129,12
All this the world well knows; yet none knows well,50,10,CXXIX,129,13
To shun the heaven that leads men to this hell.,47,10,CXXIX,129,14
CXXX,4,1,CXXX,130,0
My mistress' eyes are nothing like the sun;,43,8,CXXX,130,1
"Coral is far more red, than her lips red:",41,9,CXXX,130,2
"If snow be white, why then her breasts are dun;",47,10,CXXX,130,3
"If hairs be wires, black wires grow on her head.",48,10,CXXX,130,4
"I have seen roses damask'd, red and white,",42,8,CXXX,130,5
But no such roses see I in her cheeks;,38,9,CXXX,130,6
And in some perfumes is there more delight,42,8,CXXX,130,7
Than in the breath that from my mistress reeks.,47,9,CXXX,130,8
"I love to hear her speak, yet well I know",41,10,CXXX,130,9
That music hath a far more pleasing sound:,42,8,CXXX,130,10
"I grant I never saw a goddess go,--",35,8,CXXX,130,11
"My mistress, when she walks, treads on the ground:",50,9,CXXX,130,12
"And yet by heaven, I think my love as rare,",43,10,CXXX,130,13
As any she belied with false compare.,37,7,CXXX,130,14
CXXXI,5,1,CXXXI,131,0
"Thou art as tyrannous, so as thou art,",38,8,CXXXI,131,1
As those whose beauties proudly make them cruel;,48,8,CXXXI,131,2
For well thou know'st to my dear doting heart,45,9,CXXXI,131,3
Thou art the fairest and most precious jewel.,45,8,CXXXI,131,4
"Yet, in good faith, some say that thee behold,",46,9,CXXXI,131,5
Thy face hath not the power to make love groan;,47,10,CXXXI,131,6
"To say they err I dare not be so bold,",38,10,CXXXI,131,7
Although I swear it to myself alone.,36,7,CXXXI,131,8
"And to be sure that is not false I swear,",41,10,CXXXI,131,9
"A thousand groans, but thinking on thy face,",44,8,CXXXI,131,10
"One on another's neck, do witness bear",38,7,CXXXI,131,11
Thy black is fairest in my judgment's place.,44,8,CXXXI,131,12
"In nothing art thou black save in thy deeds,",44,9,CXXXI,131,13
"And thence this slander, as I think, proceeds.",46,8,CXXXI,131,14
CXXXII,6,1,CXXXII,132,0
"Thine eyes I love, and they, as pitying me,",43,9,CXXXII,132,1
"Knowing thy heart torment me with disdain,",42,7,CXXXII,132,2
"Have put on black and loving mourners be,",41,8,CXXXII,132,3
Looking with pretty ruth upon my pain.,38,7,CXXXII,132,4
And truly not the morning sun of heaven,39,8,CXXXII,132,5
"Better becomes the grey cheeks of the east,",43,8,CXXXII,132,6
"Nor that full star that ushers in the even,",43,9,CXXXII,132,7
"Doth half that glory to the sober west,",39,8,CXXXII,132,8
As those two mourning eyes become thy face:,43,8,CXXXII,132,9
O! let it then as well beseem thy heart,39,9,CXXXII,132,10
"To mourn for me since mourning doth thee grace,",47,9,CXXXII,132,11
And suit thy pity like in every part.,37,8,CXXXII,132,12
"Then will I swear beauty herself is black,",42,8,CXXXII,132,13
And all they foul that thy complexion lack.,43,8,CXXXII,132,14
CXXXIII,7,1,CXXXIII,133,0
Beshrew that heart that makes my heart to groan,47,9,CXXXIII,133,1
For that deep wound it gives my friend and me!,46,10,CXXXIII,133,2
"Is't not enough to torture me alone,",36,7,CXXXIII,133,3
But slave to slavery my sweet'st friend must be?,48,9,CXXXIII,133,4
"Me from myself thy cruel eye hath taken,",40,8,CXXXIII,133,5
And my next self thou harder hast engross'd:,44,8,CXXXIII,133,6
"Of him, myself, and thee I am forsaken;",39,8,CXXXIII,133,7
A torment thrice three-fold thus to be cross'd:,47,8,CXXXIII,133,8
"Prison my heart in thy steel bosom's ward,",42,8,CXXXIII,133,9
But then my friend's heart let my poor heart bail;,50,10,CXXXIII,133,10
"Whoe'er keeps me, let my heart be his guard;",44,9,CXXXIII,133,11
Thou canst not then use rigour in my jail:,42,9,CXXXIII,133,12
"And yet thou wilt; for I, being pent in thee,",45,10,CXXXIII,133,13
"Perforce am thine, and all that is in me.",41,9,CXXXIII,133,14
CXXXIV,6,1,CXXXIV,134,0
"So, now I have confess'd that he is thine,",42,9,CXXXIV,134,1
"And I my self am mortgag'd to thy will,",39,9,CXXXIV,134,2
"Myself I'll forfeit, so that other mine",39,7,CXXXIV,134,3
Thou wilt restore to be my comfort still:,41,8,CXXXIV,134,4
"But thou wilt not, nor he will not be free,",43,10,CXXXIV,134,5
"For thou art covetous, and he is kind;",38,8,CXXXIV,134,6
"He learn'd but surety-like to write for me,",43,8,CXXXIV,134,7
Under that bond that him as fast doth bind.,43,9,CXXXIV,134,8
"The statute of thy beauty thou wilt take,",41,8,CXXXIV,134,9
"Thou usurer, that putt'st forth all to use,",43,8,CXXXIV,134,10
And sue a friend came debtor for my sake;,41,9,CXXXIV,134,11
So him I lose through my unkind abuse.,38,8,CXXXIV,134,12
Him have I lost; thou hast both him and me:,43,10,CXXXIV,134,13
"He pays the whole, and yet am I not free.",41,10,CXXXIV,134,14
CXXXV,5,1,CXXXV,135,0
"Whoever hath her wish, thou hast thy 'Will,'",44,8,CXXXV,135,1
"And 'Will' to boot, and 'Will' in over-plus;",44,8,CXXXV,135,2
"More than enough am I that vex'd thee still,",44,9,CXXXV,135,3
To thy sweet will making addition thus.,39,7,CXXXV,135,4
"Wilt thou, whose will is large and spacious,",44,8,CXXXV,135,5
Not once vouchsafe to hide my will in thine?,44,9,CXXXV,135,6
"Shall will in others seem right gracious,",41,7,CXXXV,135,7
And in my will no fair acceptance shine?,40,8,CXXXV,135,8
"The sea, all water, yet receives rain still,",44,8,CXXXV,135,9
And in abundance addeth to his store;,37,7,CXXXV,135,10
"So thou, being rich in 'Will,' add to thy 'Will'",48,10,CXXXV,135,11
"One will of mine, to make thy large will more.",46,10,CXXXV,135,12
Let no unkind 'No' fair beseechers kill;,40,7,CXXXV,135,13
"Think all but one, and me in that one 'Will.'",45,10,CXXXV,135,14
CXXXVI,6,1,CXXXVI,136,0
"If thy soul check thee that I come so near,",43,10,CXXXVI,136,1
"Swear to thy blind soul that I was thy 'Will',",46,10,CXXXVI,136,2
"And will, thy soul knows, is admitted there;",44,8,CXXXVI,136,3
"Thus far for love, my love-suit, sweet, fulfil.",47,8,CXXXVI,136,4
"'Will', will fulfil the treasure of thy love,",45,8,CXXXVI,136,5
"Ay, fill it full with wills, and my will one.",45,10,CXXXVI,136,6
In things of great receipt with ease we prove,45,9,CXXXVI,136,7
Among a number one is reckon'd none:,36,7,CXXXVI,136,8
"Then in the number let me pass untold,",38,8,CXXXVI,136,9
Though in thy store's account I one must be;,44,9,CXXXVI,136,10
"For nothing hold me, so it please thee hold",43,9,CXXXVI,136,11
"That nothing me, a something sweet to thee:",43,8,CXXXVI,136,12
"Make but my name thy love, and love that still,",47,10,CXXXVI,136,13
And then thou lov'st me for my name is 'Will.',46,10,CXXXVI,136,14
CXXXVII,7,1,CXXXVII,137,0
"Thou blind fool, Love, what dost thou to mine eyes,",51,10,CXXXVII,137,1
"That they behold, and see not what they see?",44,9,CXXXVII,137,2
"They know what beauty is, see where it lies,",44,9,CXXXVII,137,3
Yet what the best is take the worst to be.,42,10,CXXXVII,137,4
"If eyes, corrupt by over-partial looks,",39,6,CXXXVII,137,5
"Be anchor'd in the bay where all men ride,",42,9,CXXXVII,137,6
"Why of eyes' falsehood hast thou forged hooks,",46,8,CXXXVII,137,7
Whereto the judgment of my heart is tied?,41,8,CXXXVII,137,8
"Why should my heart think that a several plot,",46,9,CXXXVII,137,9
Which my heart knows the wide world's common place?,51,9,CXXXVII,137,10
"Or mine eyes, seeing this, say this is not,",43,9,CXXXVII,137,11
To put fair truth upon so foul a face?,38,9,CXXXVII,137,12
"In things right true my heart and eyes have err'd,",50,10,CXXXVII,137,13
And to this false plague are they now transferr'd.,50,9,CXXXVII,137,14
CXXXVIII,8,1,CXXXVIII,138,0
"When my love swears that she is made of truth,",46,10,CXXXVIII,138,1
"I do believe her though I know she lies,",40,9,CXXXVIII,138,2
"That she might think me some untutor'd youth,",45,8,CXXXVIII,138,3
Unlearned in the world's false subtleties.,42,6,CXXXVIII,138,4
"Thus vainly thinking that she thinks me young,",46,8,CXXXVIII,138,5
"Although she knows my days are past the best,",45,9,CXXXVIII,138,6
Simply I credit her false-speaking tongue:,42,6,CXXXVIII,138,7
On both sides thus is simple truth suppressed:,46,8,CXXXVIII,138,8
But wherefore says she not she is unjust?,41,8,CXXXVIII,138,9
And wherefore say not I that I am old?,38,9,CXXXVIII,138,10
"O! love's best habit is in seeming trust,",41,8,CXXXVIII,138,11
"And age in love, loves not to have years told:",46,10,CXXXVIII,138,12
"Therefore I lie with her, and she with me,",42,9,CXXXVIII,138,13
And in our faults by lies we flatter'd be.,42,9,CXXXVIII,138,14
CXXXIX,6,1,CXXXIX,139,0
O! call not me to justify the wrong,35,8,CXXXIX,139,1
That thy unkindness lays upon my heart;,39,7,CXXXIX,139,2
"Wound me not with thine eye, but with thy tongue:",49,10,CXXXIX,139,3
"Use power with power, and slay me not by art,",45,10,CXXXIX,139,4
"Tell me thou lov'st elsewhere; but in my sight,",47,9,CXXXIX,139,5
"Dear heart, forbear to glance thine eye aside:",46,8,CXXXIX,139,6
"What need'st thou wound with cunning, when thy might",52,9,CXXXIX,139,7
Is more than my o'erpress'd defence can bide?,45,8,CXXXIX,139,8
Let me excuse thee: ah! my love well knows,42,9,CXXXIX,139,9
Her pretty looks have been mine enemies;,40,7,CXXXIX,139,10
"And therefore from my face she turns my foes,",45,9,CXXXIX,139,11
That they elsewhere might dart their injuries:,46,7,CXXXIX,139,12
"Yet do not so; but since I am near slain,",41,10,CXXXIX,139,13
"Kill me outright with looks, and rid my pain.",45,9,CXXXIX,139,14
CXL,3,1,CXL,140,0
Be wise as thou art cruel; do not press,39,9,CXL,140,1
My tongue-tied patience with too much disdain;,46,7,CXL,140,2
"Lest sorrow lend me words, and words express",44,8,CXL,140,3
The manner of my pity-wanting pain.,35,6,CXL,140,4
"If I might teach thee wit, better it were,",42,9,CXL,140,5
"Though not to love, yet, love to tell me so;--",46,10,CXL,140,6
"As testy sick men, when their deaths be near,",45,9,CXL,140,7
No news but health from their physicians know;--,48,8,CXL,140,8
"For, if I should despair, I should grow mad,",44,9,CXL,140,9
And in my madness might speak ill of thee;,42,9,CXL,140,10
"Now this ill-wresting world is grown so bad,",44,8,CXL,140,11
Mad slanderers by mad ears believed be.,39,7,CXL,140,12
"That I may not be so, nor thou belied,",38,9,CXL,140,13
"Bear thine eyes straight, though thy proud heart go wide.",57,10,CXL,140,14
CXLI,4,1,CXLI,141,0
"In faith I do not love thee with mine eyes,",43,10,CXLI,141,1
For they in thee a thousand errors note;,40,8,CXLI,141,2
"But 'tis my heart that loves what they despise,",47,9,CXLI,141,3
"Who, in despite of view, is pleased to dote.",44,9,CXLI,141,4
Nor are mine ears with thy tongue's tune delighted;,51,9,CXLI,141,5
"Nor tender feeling, to base touches prone,",42,7,CXLI,141,6
"Nor taste, nor smell, desire to be invited",42,8,CXLI,141,7
To any sensual feast with thee alone:,37,7,CXLI,141,8
But my five wits nor my five senses can,39,9,CXLI,141,9
"Dissuade one foolish heart from serving thee,",45,7,CXLI,141,10
"Who leaves unsway'd the likeness of a man,",42,8,CXLI,141,11
Thy proud heart's slave and vassal wretch to be:,48,9,CXLI,141,12
"Only my plague thus far I count my gain,",40,9,CXLI,141,13
That she that makes me sin awards me pain.,42,9,CXLI,141,14
CXLII,5,1,CXLII,142,0
"Love is my sin, and thy dear virtue hate,",41,9,CXLII,142,1
"Hate of my sin, grounded on sinful loving:",42,8,CXLII,142,2
"O! but with mine compare thou thine own state,",46,9,CXLII,142,3
And thou shalt find it merits not reproving;,44,8,CXLII,142,4
"Or, if it do, not from those lips of thine,",43,10,CXLII,142,5
That have profan'd their scarlet ornaments,42,6,CXLII,142,6
"And seal'd false bonds of love as oft as mine,",46,10,CXLII,142,7
Robb'd others' beds' revenues of their rents.,45,7,CXLII,142,8
"Be it lawful I love thee, as thou lov'st those",46,10,CXLII,142,9
Whom thine eyes woo as mine importune thee:,43,8,CXLII,142,10
"Root pity in thy heart, that, when it grows,",44,9,CXLII,142,11
Thy pity may deserve to pitied be.,34,7,CXLII,142,12
"If thou dost seek to have what thou dost hide,",46,10,CXLII,142,13
By self-example mayst thou be denied!,37,6,CXLII,142,14
CXLIII,6,1,CXLIII,143,0
"Lo, as a careful housewife runs to catch",40,8,CXLIII,143,1
"One of her feather'd creatures broke away,",42,7,CXLIII,143,2
"Sets down her babe, and makes all swift dispatch",48,9,CXLIII,143,3
In pursuit of the thing she would have stay;,44,9,CXLIII,143,4
"Whilst her neglected child holds her in chase,",46,8,CXLIII,143,5
Cries to catch her whose busy care is bent,42,9,CXLIII,143,6
"To follow that which flies before her face,",43,8,CXLIII,143,7
Not prizing her poor infant's discontent;,41,6,CXLIII,143,8
"So runn'st thou after that which flies from thee,",49,9,CXLIII,143,9
Whilst I thy babe chase thee afar behind;,41,8,CXLIII,143,10
"But if thou catch thy hope, turn back to me,",44,10,CXLIII,143,11
"And play the mother's part, kiss me, be kind;",45,9,CXLIII,143,12
"So will I pray that thou mayst have thy 'Will,'",47,10,CXLIII,143,13
If thou turn back and my loud crying still.,43,9,CXLIII,143,14
CXLIV,5,1,CXLIV,144,0
"Two loves I have of comfort and despair,",40,8,CXLIV,144,1
Which like two spirits do suggest me still:,43,8,CXLIV,144,2
"The better angel is a man right fair,",37,8,CXLIV,144,3
The worser spirit a woman colour'd ill.,39,7,CXLIV,144,4
"To win me soon to hell, my female evil,",39,9,CXLIV,144,5
"Tempteth my better angel from my side,",38,7,CXLIV,144,6
"And would corrupt my saint to be a devil,",41,9,CXLIV,144,7
Wooing his purity with her foul pride.,38,7,CXLIV,144,8
"And whether that my angel be turn'd fiend,",42,8,CXLIV,144,9
"Suspect I may, yet not directly tell;",37,7,CXLIV,144,10
"But being both from me, both to each friend,",44,9,CXLIV,144,11
I guess one angel in another's hell:,36,7,CXLIV,144,12
"Yet this shall I ne'er know, but live in doubt,",47,10,CXLIV,144,13
Till my bad angel fire my good one out.,39,9,CXLIV,144,14
CXLV,4,1,CXLV,145,0
"Those lips that Love's own hand did make,",41,8,CXLV,145,1
"Breathed forth the sound that said 'I hate',",44,8,CXLV,145,2
To me that languish'd for her sake:,35,7,CXLV,145,3
"But when she saw my woeful state,",33,7,CXLV,145,4
"Straight in her heart did mercy come,",37,7,CXLV,145,5
Chiding that tongue that ever sweet,35,6,CXLV,145,6
Was us'd in giving gentle doom;,31,6,CXLV,145,7
And taught it thus anew to greet;,33,7,CXLV,145,8
"'I hate' she alter'd with an end,",33,7,CXLV,145,9
"That followed it as gentle day,",31,6,CXLV,145,10
"Doth follow night, who like a fiend",35,7,CXLV,145,11
From heaven to hell is flown away.,34,7,CXLV,145,12
"'I hate', from hate away she threw,",35,7,CXLV,145,13
"And sav'd my life, saying 'not you'.",36,7,CXLV,145,14
CXLVI,5,1,CXLVI,146,0
"Poor soul, the centre of my sinful earth,",41,8,CXLVI,146,1
"My sinful earth these rebel powers array,",41,7,CXLVI,146,2
"Why dost thou pine within and suffer dearth,",44,8,CXLVI,146,3
Painting thy outward walls so costly gay?,41,7,CXLVI,146,4
"Why so large cost, having so short a lease,",43,9,CXLVI,146,5
Dost thou upon thy fading mansion spend?,40,7,CXLVI,146,6
"Shall worms, inheritors of this excess,",39,6,CXLVI,146,7
Eat up thy charge? Is this thy body's end?,42,9,CXLVI,146,8
"Then soul, live thou upon thy servant's loss,",45,8,CXLVI,146,9
And let that pine to aggravate thy store;,41,8,CXLVI,146,10
Buy terms divine in selling hours of dross;,43,8,CXLVI,146,11
"Within be fed, without be rich no more:",39,8,CXLVI,146,12
"So shall thou feed on Death, that feeds on men,",47,10,CXLVI,146,13
"And Death once dead, there's no more dying then.",48,9,CXLVI,146,14
CXLVII,6,1,CXLVII,147,0
"My love is as a fever longing still,",36,8,CXLVII,147,1
For that which longer nurseth the disease;,42,7,CXLVII,147,2
"Feeding on that which doth preserve the ill,",44,8,CXLVII,147,3
The uncertain sickly appetite to please.,40,6,CXLVII,147,4
"My reason, the physician to my love,",36,7,CXLVII,147,5
"Angry that his prescriptions are not kept,",42,7,CXLVII,147,6
"Hath left me, and I desperate now approve",41,8,CXLVII,147,7
